{
  "version": "2026-10-14.3",
  "catalog": {
    "path": "backend/dataset/actions.agent.json",
    "sha256": "d3fd22334038a8a3803ce191acf28847003cb1057673dbbb0a470d153fa80b30",
    "count": 1321
  },
  "encoding_rule_version": "retrieval-text-2026-10-14.2",
  "label_status": "approved",
  "grade_scale": {
    "3": "高度相关：指名动作或核心符合意图",
    "2": "相关：同类动作或合理替代变式",
    "1": "弱相关：同部位但动作模式或器械差异明显",
    "0": "不相关"
  },
  "split_rule": "按 intent 与 family 分组整体划入 dev 或 holdout；同一 family 的表达变体不跨集，holdout 不参与别名维护与调参。",
  "baseline_rule": "基线把查询原文 query 作为 name 子串传入 Catalog.search，并把 filters 的四项作为精确筛选；不做别名展开、翻译、分词或画像过滤。人工名称改写仅记录在 baseline_name 供单独报告，不进入主对照。",
  "queries": [
    {
      "id": "q-standard-001",
      "query": "杠铃卧推",
      "intent": "standard_name",
      "purpose": "search",
      "filters": {
        "equipment": null,
        "body_part": null,
        "target": null,
        "muscle_group": null
      },
      "environment": null,
      "declared_equipment": [],
      "temporary_restrictions": [],
      "saved_profile_restrictions": {
        "unavailable_equipment": [],
        "forbidden_exercise_ids": []
      },
      "labels": [
        {
          "id": "0025",
          "grade": 3
        },
        {
          "id": "0047",
          "grade": 2
        },
        {
          "id": "0289",
          "grade": 2
        }
      ],
      "expect_empty": false,
      "label_status": "approved",
      "split": "dev",
      "family": "bench-press",
      "baseline_name": "杠铃卧推",
      "notes": null
    },
    {
      "id": "q-standard-002",
      "query": "哑铃卧推",
      "intent": "standard_name",
      "purpose": "search",
      "filters": {
        "equipment": null,
        "body_part": null,
        "target": null,
        "muscle_group": null
      },
      "environment": null,
      "declared_equipment": [],
      "temporary_restrictions": [],
      "saved_profile_restrictions": {
        "unavailable_equipment": [],
        "forbidden_exercise_ids": []
      },
      "labels": [
        {
          "id": "0289",
          "grade": 3
        },
        {
          "id": "0314",
          "grade": 2
        },
        {
          "id": "0025",
          "grade": 2
        }
      ],
      "expect_empty": false,
      "label_status": "approved",
      "split": "dev",
      "family": "bench-press",
      "baseline_name": "哑铃卧推",
      "notes": null
    },
    {
      "id": "q-standard-003",
      "query": "杠铃俯身划船",
      "intent": "standard_name",
      "purpose": "search",
      "filters": {
        "equipment": null,
        "body_part": null,
        "target": null,
        "muscle_group": null
      },
      "environment": null,
      "declared_equipment": [],
      "temporary_restrictions": [],
      "saved_profile_restrictions": {
        "unavailable_equipment": [],
        "forbidden_exercise_ids": []
      },
      "labels": [
        {
          "id": "0027",
          "grade": 3
        },
        {
          "id": "0118",
          "grade": 2
        },
        {
          "id": "0064",
          "grade": 2
        }
      ],
      "expect_empty": false,
      "label_status": "approved",
      "split": "dev",
      "family": "row",
      "baseline_name": "杠铃俯身划船",
      "notes": null
    },
    {
      "id": "q-standard-004",
      "query": "哑铃俯身划船",
      "intent": "standard_name",
      "purpose": "search",
      "filters": {
        "equipment": null,
        "body_part": null,
        "target": null,
        "muscle_group": null
      },
      "environment": null,
      "declared_equipment": [],
      "temporary_restrictions": [],
      "saved_profile_restrictions": {
        "unavailable_equipment": [],
        "forbidden_exercise_ids": []
      },
      "labels": [
        {
          "id": "0293",
          "grade": 3
        },
        {
          "id": "0292",
          "grade": 2
        },
        {
          "id": "0327",
          "grade": 2
        }
      ],
      "expect_empty": false,
      "label_status": "approved",
      "split": "dev",
      "family": "row",
      "baseline_name": "哑铃俯身划船",
      "notes": null
    },
    {
      "id": "q-standard-005",
      "query": "绳索坐姿划船",
      "intent": "standard_name",
      "purpose": "search",
      "filters": {
        "equipment": null,
        "body_part": null,
        "target": null,
        "muscle_group": null
      },
      "environment": null,
      "declared_equipment": [],
      "temporary_restrictions": [],
      "saved_profile_restrictions": {
        "unavailable_equipment": [],
        "forbidden_exercise_ids": []
      },
      "labels": [
        {
          "id": "0861",
          "grade": 3
        },
        {
          "id": "0180",
          "grade": 2
        },
        {
          "id": "0218",
          "grade": 2
        }
      ],
      "expect_empty": false,
      "label_status": "approved",
      "split": "dev",
      "family": "row",
      "baseline_name": "绳索坐姿划船",
      "notes": null
    },
    {
      "id": "q-standard-006",
      "query": "俯卧撑",
      "intent": "standard_name",
      "purpose": "search",
      "filters": {
        "equipment": null,
        "body_part": null,
        "target": null,
        "muscle_group": null
      },
      "environment": null,
      "declared_equipment": [],
      "temporary_restrictions": [],
      "saved_profile_restrictions": {
        "unavailable_equipment": [],
        "forbidden_exercise_ids": []
      },
      "labels": [
        {
          "id": "0662",
          "grade": 3
        },
        {
          "id": "0258",
          "grade": 2
        },
        {
          "id": "0279",
          "grade": 2
        }
      ],
      "expect_empty": false,
      "label_status": "approved",
      "split": "dev",
      "family": "push-up",
      "baseline_name": "俯卧撑",
      "notes": null
    },
    {
      "id": "q-standard-007",
      "query": "引体向上",
      "intent": "standard_name",
      "purpose": "search",
      "filters": {
        "equipment": null,
        "body_part": null,
        "target": null,
        "muscle_group": null
      },
      "environment": null,
      "declared_equipment": [],
      "temporary_restrictions": [],
      "saved_profile_restrictions": {
        "unavailable_equipment": [],
        "forbidden_exercise_ids": []
      },
      "labels": [
        {
          "id": "0652",
          "grade": 3
        },
        {
          "id": "0017",
          "grade": 2
        },
        {
          "id": "3293",
          "grade": 2
        }
      ],
      "expect_empty": false,
      "label_status": "approved",
      "split": "dev",
      "family": "pull-up",
      "baseline_name": "引体向上",
      "notes": null
    },
    {
      "id": "q-standard-008",
      "query": "杠铃弯举",
      "intent": "standard_name",
      "purpose": "search",
      "filters": {
        "equipment": null,
        "body_part": null,
        "target": null,
        "muscle_group": null
      },
      "environment": null,
      "declared_equipment": [],
      "temporary_restrictions": [],
      "saved_profile_restrictions": {
        "unavailable_equipment": [],
        "forbidden_exercise_ids": []
      },
      "labels": [
        {
          "id": "0031",
          "grade": 3
        },
        {
          "id": "0868",
          "grade": 2
        },
        {
          "id": "0023",
          "grade": 2
        }
      ],
      "expect_empty": false,
      "label_status": "approved",
      "split": "dev",
      "family": "curl",
      "baseline_name": "杠铃弯举",
      "notes": null
    },
    {
      "id": "q-standard-009",
      "query": "哑铃侧平举",
      "intent": "standard_name",
      "purpose": "search",
      "filters": {
        "equipment": null,
        "body_part": null,
        "target": null,
        "muscle_group": null
      },
      "environment": null,
      "declared_equipment": [],
      "temporary_restrictions": [],
      "saved_profile_restrictions": {
        "unavailable_equipment": [],
        "forbidden_exercise_ids": []
      },
      "labels": [
        {
          "id": "0334",
          "grade": 3
        },
        {
          "id": "0355",
          "grade": 2
        },
        {
          "id": "0396",
          "grade": 2
        }
      ],
      "expect_empty": false,
      "label_status": "approved",
      "split": "dev",
      "family": "lateral-raise",
      "baseline_name": "哑铃侧平举",
      "notes": null
    },
    {
      "id": "q-standard-010",
      "query": "杠铃臀桥",
      "intent": "standard_name",
      "purpose": "search",
      "filters": {
        "equipment": null,
        "body_part": null,
        "target": null,
        "muscle_group": null
      },
      "environment": null,
      "declared_equipment": [],
      "temporary_restrictions": [],
      "saved_profile_restrictions": {
        "unavailable_equipment": [],
        "forbidden_exercise_ids": []
      },
      "labels": [
        {
          "id": "1409",
          "grade": 3
        },
        {
          "id": "3562",
          "grade": 2
        },
        {
          "id": "1408",
          "grade": 2
        }
      ],
      "expect_empty": false,
      "label_status": "approved",
      "split": "dev",
      "family": "glute-bridge",
      "baseline_name": "杠铃臀桥",
      "notes": null
    },
    {
      "id": "q-standard-011",
      "query": "杠铃硬拉",
      "intent": "standard_name",
      "purpose": "search",
      "filters": {
        "equipment": null,
        "body_part": null,
        "target": null,
        "muscle_group": null
      },
      "environment": null,
      "declared_equipment": [],
      "temporary_restrictions": [],
      "saved_profile_restrictions": {
        "unavailable_equipment": [],
        "forbidden_exercise_ids": []
      },
      "labels": [
        {
          "id": "0032",
          "grade": 3
        },
        {
          "id": "0085",
          "grade": 2
        },
        {
          "id": "0116",